{
  "schema": "bundle-connector-1",
  "connector_id": "synthetic-bank",
  "started_at": "2026-01-04T06:59:00-05:00",
  "completed_at": "2026-01-04T12:00:00Z",
  "accounts": [
    {
      "account_id": "card",
      "source_id": "bank-export-7",
      "source_version": 1,
      "currency": "usd",
      "display_name": "Synthetic Card",
      "institution_name": "Synthetic Credit Union",
      "account_type": "Credit_Card",
      "account_subtype": "rewards",
      "last_four": "0042"
    }
  ],
  "balances": [
    {
      "account_id": "checking",
      "current_minor": 312345,
      "available_minor": 300000,
      "observed_at": "2026-01-04T11:00:00Z",
      "status": "valid",
      "source_ref": {
        "source_id": "bank-export-7",
        "source_kind": "local_api",
        "provider_id": null,
        "external_object_id": "export-7",
        "imported_at": "2026-01-04T12:00:00Z",
        "observed_at": "2026-01-04T11:59:00Z",
        "content_hash": "sha256:abababababababababababababababababababababababababababababababab",
        "source_version": 1,
        "metadata": {
          "exporter": "synthetic",
          "note": "naïve café ☕",
          "pages": 2,
          "ratio": 0.1
        }
      }
    },
    {
      "observation_id": "old-checking",
      "account_id": "checking",
      "current_minor": 1,
      "available_minor": 1,
      "observed_at": "2026-01-01T00:00:00Z",
      "status": "Stale",
      "source_ref": {
        "source_id": "bank-export-7",
        "source_kind": "local_api",
        "provider_id": null,
        "external_object_id": "export-7",
        "imported_at": "2026-01-04T12:00:00Z",
        "observed_at": "2026-01-04T11:59:00Z",
        "content_hash": "sha256:abababababababababababababababababababababababababababababababab",
        "source_version": 1,
        "metadata": {
          "exporter": "synthetic",
          "note": "naïve café ☕",
          "pages": 2,
          "ratio": 0.1
        }
      }
    },
    {
      "account_id": "savings",
      "current_minor": 50000,
      "observed_at": "2026-01-04T11:00:00Z",
      "source_ref": {
        "source_id": "bank-export-7",
        "source_kind": "local_api",
        "provider_id": null,
        "external_object_id": "export-7",
        "imported_at": "2026-01-04T12:00:00Z",
        "observed_at": "2026-01-04T11:59:00Z",
        "content_hash": "sha256:abababababababababababababababababababababababababababababababab",
        "source_version": 1,
        "metadata": {
          "exporter": "synthetic",
          "note": "naïve café ☕",
          "pages": 2,
          "ratio": 0.1
        }
      }
    },
    {
      "account_id": "card",
      "current_minor": 4200,
      "available_minor": 95800,
      "observed_at": "2026-01-04T11:00:00Z",
      "status": "valid",
      "source_ref": {
        "source_id": "bank-export-7",
        "source_kind": "local_api",
        "provider_id": null,
        "external_object_id": "export-7",
        "imported_at": "2026-01-04T12:00:00Z",
        "observed_at": "2026-01-04T11:59:00Z",
        "content_hash": "sha256:abababababababababababababababababababababababababababababababab",
        "source_version": 1,
        "metadata": {
          "exporter": "synthetic",
          "note": "naïve café ☕",
          "pages": 2,
          "ratio": 0.1
        }
      }
    }
  ],
  "transactions": [
    {
      "transaction_id": "card-001",
      "account_id": "card",
      "source_transaction_id": "card-001",
      "revision": 1,
      "amount": {
        "minor_units": 4200,
        "currency": "USD"
      },
      "direction": "debit",
      "transaction_state": "posted",
      "merchant_raw": "SYNTH GROCER #12",
      "merchant_id": null,
      "description": "Groceries",
      "category_id": "food",
      "authorized_at": "2026-01-03T18:00:00+01:00",
      "posted_at": "2026-01-04T00:00:00Z",
      "observed_at": "2026-01-04T11:00:00Z",
      "user_note": "weekly shop",
      "user_tags": [
        "groceries",
        "wöchentlich"
      ],
      "source_ref": {
        "source_id": "bank-export-7",
        "source_kind": "local_api",
        "provider_id": null,
        "external_object_id": "export-7",
        "imported_at": "2026-01-04T12:00:00Z",
        "observed_at": "2026-01-04T11:59:00Z",
        "content_hash": "sha256:abababababababababababababababababababababababababababababababab",
        "source_version": 1,
        "metadata": {
          "exporter": "synthetic",
          "note": "naïve café ☕",
          "pages": 2,
          "ratio": 0.1
        }
      }
    }
  ],
  "external_commitments": [],
  "next_cursor": "cursor-after-7",
  "warnings": [
    "synthetic warning — none real"
  ]
}
